{
  "decision": "go to the party on a work night",
  "risk_tolerance": 4,
  "pros": [
    {
      "description": "Social networking opportunity",
      "impact": 6,
      "likelihood": 0.8,
      "cost": 0,
      "input_source": "MACHINE"
    },
    {
      "description": "Stress relief and enjoyment",
      "impact": 7,
      "likelihood": 0.9,
      "cost": 20,
      "input_source": "MACHINE"
    },
    {
      "description": "Maintaining friendships",
      "impact": 8,
      "likelihood": 0.95,
      "cost": 0,
      "input_source": "MACHINE"
    }
  ],
  "cons": [
    {
      "description": "Reduced sleep affecting next day's work performance",
      "impact": 8,
      "likelihood": 0.9,
      "cost": 0,
      "input_source": "MACHINE"
    },
    {
      "description": "Potential hangover",
      "impact": 7,
      "likelihood": 0.6,
      "cost": 10,
      "input_source": "MACHINE"
    },
    {
      "description": "Money spent on transportation and drinks",
      "impact": 4,
      "likelihood": 1.0,
      "cost": 50,
      "input_source": "MACHINE"
    }
  ],
  "opportunity_costs": [
    {
      "description": "Lost productive evening work time",
      "impact": 6,
      "likelihood": 1.0,
      "value": 100,
      "input_source": "MACHINE"
    },
    {
      "description": "Missed early morning gym session",
      "impact": 5,
      "likelihood": 0.8,
      "value": 30,
      "input_source": "MACHINE"
    }
  ],
  "timestamp": "2025-01-04T19:30:00Z",
  "ai_analysis": {
    "analysis": {
      "summary": "**Decision Analysis: Attend Party or Not?**\n\n**Summary of Key Points**\n\nThe decision to attend the party on a work night involves weighing various pros and cons, including social networking opportunit...",
      "confidence": 0.8,
      "recommendations": [
        "**Decision Analysis: Attend Party or Not?**\n\n**Summary of Key Points**\n\nThe decision to attend the party on a work night involves weighing various pros and cons, including social networking opportunities, stress relief, maintaining friendships, reduced sleep affecting next day's work performance, potential hangover, money spent on transportation and drinks, lost productive evening work time, missed early morning gym session, and opportunity costs. The analysis will consider these factors to provide a comprehensive decision.\n\n**Quantitative Analysis**\n\n### Pros\n\n| Factor | Impact (0-10) | Likelihood (0-1) |\n| --- | --- | --- |\n| Social networking | 6/10 | 0.8 |\n| Stress relief and enjoyment | 7/10 | 0.9 |\n| Maintaining friendships | 8/10 | 0.95 |\n\n### Costs\n\n| Factor | Cost ($) |\n| --- | --- |\n| Transportation and drinks | $50 |\n\n**Weighted Impacts**\n\n* Social networking: 6 x 0.8 = 4.8\n* Stress relief and enjoyment: 7 x 0.9 = 6.3\n* Maintaining friendships: 8 x 0.95 = 7.6\n\n### Cons\n\n| Factor | Impact (0-10) | Likelihood (0-1) |\n| --- | --- | --- |\n| Reduced sleep affecting next day's work performance | 8/10 | 0.9 |\n| Potential hangover | 7/10 | 0.6 |\n| Money spent on transportation and drinks | 4/10 | 1.0 |\n\n### Costs\n\n| Factor | Cost ($) |\n| --- | --- |\n| Transportation and drinks | $50 |\n| Reduced sleep affecting next day's work performance | $0 |\n| Potential hangover | $10 |\n\n**Weighted Impacts**\n\n* Reduced sleep affecting next day's work performance: 8 x 0.9 = 7.2\n* Potential hangover: 7 x 0.6 = 4.2\n* Money spent on transportation and drinks: 4 x 1.0 = 4\n\n**Total Weighted Impacts**\n\nPros: 4.8 + 6.3 + 7.6 = 18.7\nCons: 7.2 + 4.2 + 4 = 15.4\n\n**Opportunity Costs**\n\n| Factor | Impact (0-10) | Likelihood (0-1) | Value ($) |\n| --- | --- | --- | --- |\n| Lost productive evening work time | 6/10 | 1.0 | $100 |\n| Missed early morning gym session | 5/10 | 0.8 | $30 |\n\n**Opportunity Costs Analysis**\n\n* Lost productive evening work time: 6 x 1.0 = 6, Value: $100\n* Missed early morning gym session: 5 x 0.8 = 4, Value: $30\n\n**Risk Assessment**\n\n| Factor | Impact (0-10) | Likelihood (0-1) |\n| --- | --- | --- |\n| User's risk tolerance | 4/10 |\n\nBased on the user's risk tolerance of 4/10, the analysis will consider moderate to high-risk factors.\n\n* Reduced sleep affecting next day's work performance: 8 x 0.9 = 7.2 (High Risk)\n* Potential hangover: 7 x 0.6 = 4.2 (Moderate Risk)\n\n**Potential Short-Term and Long-Term Consequences**\n\nShort-term consequences:\n\n* Attending the party may lead to reduced sleep affecting next day's work performance, potential hangover, or money spent on transportation and drinks.\n* Missing a productive evening work time and an early morning gym session can also have short-term effects on productivity and physical health.\n\nLong-term consequences:\n\n* Chronic sleep deprivation can lead to long-term health issues, such as obesity, diabetes, and cardiovascular disease.\n* Irregular exercise patterns, including missing gym sessions, may contribute to weight gain, decreased energy levels, and reduced overall well-being.\n\n**Final Recommendation**\n\nConsidering the weighted impacts, opportunity costs, risk assessment, and potential short-term and long-term consequences, the decision analysis suggests:\n\n* **Attend the party**, as the benefits of social networking, stress relief, maintaining friendships, and potential personal growth outweigh the risks.\n* However, consider taking necessary precautions to minimize the impact of reduced sleep on next day's work performance (e.g., planning ahead for an early morning workout) and potentially avoiding expensive transportation and drinks.\n\nBy weighing the pros and cons, considering opportunity costs, and assessing risk tolerance, this decision analysis provides a comprehensive evaluation to support an informed choice."
      ]
    },
    "evaluation": {
      "pros_analysis": {
        "total_impact": 18.7,
        "total_cost": 20
      },
      "cons_analysis": {
        "total_impact": 15.4,
        "total_cost": 60
      },
      "risk_assessment": {
        "raw_risk_score": 5.133333333333334,
        "risk_tolerance": 4,
        "adjusted_risk_score": 3.5933333333333337
      },
      "opportunity_costs_analysis": {
        "total_impact": 10.0,
        "total_value": 130
      }
    },
    "metadata": {
      "model_used": "llama3.2",
      "timestamp": "2025-01-04T16:36:07.018823",
      "processing_time": 43.817299
    }
  }
}