{
  "decision": "go to the party on a work night",
  "risk_tolerance": 4,
  "pros": [
    {
      "description": "Social networking opportunity",
      "impact": 6,
      "likelihood": 0.8,
      "cost": 0,
      "input_source": "MACHINE"
    },
    {
      "description": "Stress relief and enjoyment",
      "impact": 7,
      "likelihood": 0.9,
      "cost": 20,
      "input_source": "MACHINE"
    },
    {
      "description": "Maintaining friendships",
      "impact": 8,
      "likelihood": 0.95,
      "cost": 0,
      "input_source": "MACHINE"
    }
  ],
  "cons": [
    {
      "description": "Reduced sleep affecting next day's work performance",
      "impact": 8,
      "likelihood": 0.9,
      "cost": 0,
      "input_source": "MACHINE"
    },
    {
      "description": "Potential hangover",
      "impact": 7,
      "likelihood": 0.6,
      "cost": 10,
      "input_source": "MACHINE"
    },
    {
      "description": "Money spent on transportation and drinks",
      "impact": 4,
      "likelihood": 1.0,
      "cost": 50,
      "input_source": "MACHINE"
    }
  ],
  "opportunity_costs": [
    {
      "description": "Lost productive evening work time",
      "impact": 6,
      "likelihood": 1.0,
      "value": 100,
      "input_source": "MACHINE"
    },
    {
      "description": "Missed early morning gym session",
      "impact": 5,
      "likelihood": 0.8,
      "value": 30,
      "input_source": "MACHINE"
    }
  ],
  "timestamp": "2025-01-04T19:30:00Z",
  "ai_analysis": {
    "analysis": {
      "summary": "**Summary of Key Points**\n\nThis analysis aims to help determine whether attending a party on a work night is worth it. The decision involves weighing the pros and cons, including social benefits, stre...",
      "confidence": 0.8,
      "recommendations": [
        "**Summary of Key Points**\n\nThis analysis aims to help determine whether attending a party on a work night is worth it. The decision involves weighing the pros and cons, including social benefits, stress relief, friendship maintenance, and potential drawbacks such as sleep deprivation, hangovers, and financial costs.\n\n**Quantitative Analysis**\n\n1. **Pros:**\n\t* Social networking opportunity (Impact 6/10, Likelihood 0.8, Cost $0): Weighted Impact = 4.8\n\t* Stress relief and enjoyment (Impact 7/10, Likelihood 0.9, Cost $20): Weighted Impact = 6.3\n\t* Maintaining friendships (Impact 8/10, Likelihood 0.95, Cost $0): Weighted Impact = 7.6\n2. **Cons:**\n\t* Reduced sleep affecting next day's work performance (Impact 8/10, Likelihood 0.9, Cost $0): Weighted Impact = 7.2\n\t* Potential hangover (Impact 7/10, Likelihood 0.6, Cost $10): Weighted Impact = 4.2\n\t* Money spent on transportation and drinks (Impact 4/10, Likelihood 1.0, Cost $50): Weighted Impact = 4\n3. **Opportunity Costs:**\n\t* Lost productive evening work time (Impact 6/10, Likelihood 1.0, Value $100): Weighted Impact = 6\n\t* Missed early morning gym session (Impact 5/10, Likelihood 0.8, Value $30): Weighted Impact = 4\n\n**Cost-Benefit Analysis**\n\nTotal weighted impacts: Pros = 18.9, Cons = 15.4, Opportunity Costs = 10\nThe party has a net weighted impact of +3.5.\n\nTotal costs:\nPros: $20 (transportation and drinks)\nCons: $70 ($50 for transportation and drinks, plus $20 for potential hangover)\nOpportunity Costs: $130 (lost productive work time) + $30 (missed gym session) = $160\nTotal cost = $250\n\n**Risk Assessment**\n\nGiven a user's risk tolerance of 4/10, the party is considered moderately risky. The high likelihood and moderate impact scores for some cons make it essential to carefully consider the potential risks.\n\n**Opportunity Costs Evaluation**\n\nThe opportunity costs are significant, with lost productive work time and missed gym session potentially affecting both short-term and long-term well-being. These costs should be prioritized, considering their impact on daily productivity and overall health.\n\n**Potential Short-Term and Long-Term Consequences**\n\nShort-term:\n- Potential sleep deprivation and hangover may affect the next day's work performance.\n- Missing a morning gym session may lead to reduced physical activity and energy levels.\n\nLong-term:\n- Chronic sleep deprivation can contribute to decreased productivity, mood disturbances, and increased risk of chronic diseases.\n- Missed gym sessions over time could result in decreased fitness levels, reduced athletic performance, or even health problems like heart disease.\n\n**Final Recommendation**\n\nBased on the quantitative analysis and considering the user's moderate risk tolerance (4/10), attending the party might be worth it, but with caution. The net weighted impact is positive (+3.5), indicating that the benefits of socializing and stress relief may outweigh the drawbacks. However, due to the high opportunity costs and potential risks associated with sleep deprivation and hangover, it's essential to:\n\n* Plan ahead for the next day, ensuring sufficient rest and preparation.\n* Be mindful of drinking limits and plan a safe ride home or arrange transportation in advance.\n* Consider alternative stress-relief strategies during work hours, such as taking breaks or exercising.\n* Prioritize daily productivity and make time for gym sessions when possible.\n\nUltimately, the decision to attend the party should be based on individual circumstances, including work responsibilities, personal commitments, and overall well-being."
      ]
    },
    "evaluation": {
      "pros_analysis": {
        "total_impact": 18.7,
        "total_cost": 20
      },
      "cons_analysis": {
        "total_impact": 15.4,
        "total_cost": 60
      },
      "risk_assessment": {
        "raw_risk_score": 5.133333333333334,
        "risk_tolerance": 4,
        "adjusted_risk_score": 3.5933333333333337
      },
      "opportunity_costs_analysis": {
        "total_impact": 10.0,
        "total_value": 130
      }
    },
    "metadata": {
      "model_used": "llama3.2",
      "timestamp": "2025-01-04T16:38:52.728627",
      "processing_time": 37.006847
    }
  }
}